{
  "id": "FIT-017",
  "revision": 1,
  "criticality": "REQUIRED",
  "category": "workflow-extension",
  "kind": "workflow-hook",
  "title": "Undeclared workflow hook is rejected",
  "given": {
    "declared_hooks": [
      "after_context",
      "before_verification"
    ],
    "requested_hook": "before_raw_tool_execution"
  },
  "when": {
    "operation": "validate-workflow-hook"
  },
  "then": {
    "extension_valid": false,
    "resolution": "INVALID"
  },
  "invariant": "Workflow customization cannot invent undeclared extension points.",
  "decision_refs": ["SAP-AW-D055"]
}
